{
    "last_run": "2026-10-12T09:29:52Z",
    "name": "blog-lychee-land",
    "image": "ghcr.io/lycheehome/blog",
    "state": "running",
    "action": "up",
    "target_tag": "none",
    "installed_tag": "none",
    "available_tag": "0.1.0",
    "installed_commit": "none",
    "result": "awaiting-image",
    "gate": "no image tag declared yet; nothing rendered or applied until one is",
    "failed_step": "",
    "failed_attempts": 0
}
