{
    "last_run": "2026-10-12T09:29:50Z",
    "name": "palsave-api",
    "image": "ghcr.io/lycheehome/palsave-api:1.4.0",
    "state": "running",
    "action": "up",
    "target_tag": "1.4.0",
    "installed_tag": "1.4.0",
    "available_tag": "1.5.0",
    "installed_commit": "none",
    "result": "deployed",
    "gate": "",
    "gate_code": "ok",
    "failed_step": "",
    "failed_attempts": 0
}
