{
    "last_run": "2026-10-12T09:29:49Z",
    "name": "palsave-api",
    "image": "ghcr.io/lycheehome/palsave-api:1.5.0",
    "state": "running",
    "action": "up",
    "target_tag": "1.5.0",
    "installed_tag": "1.4.0",
    "available_tag": "",
    "installed_commit": "none",
    "result": "blocked",
    "gate": "not applied: mount source does not exist",
    "failed_step": "",
    "failed_attempts": 1
}
